{"schema_version":"1.0","package_version":"1.0.0","feature":{"feature_id":"TLC-FC-29-GENERATIONAL-PROPAGATION-012","title":"Replication time-decay preservation guard","domain":"generational-propagation"},"purpose":"Preserve the exp(-lambda t) factor in the source Q_rep expression without compensating for its unexplained decay.","scope":{"required":[{"id":"GP012-R1","statement":"The finalized Q_rep expression retains exp(-lambda t) exactly, including when delta_x(t)=0."}],"forbidden":[{"id":"GP012-F1","statement":"Do not remove the replication time-decay factor, compensate for it, or reinterpret lambda."}],"deferred":[{"id":"GP012-D1","statement":"The scientific explanation of the residual time decay remains unresolved under TLC-UR-GENPROP-011."}]},"operations":[{"operation_id":"HANDLE-GP-012","purpose":"Return a preservation descriptor for the Q_rep time-decay requirement.","inputs":[{"name":"replication_expression","semantic_role":"Supplied descriptor of the replication-quality expression","shared_contract_ref":"TLC-HC-OPAQUE-VALUE@1.0.0","collection":{"kind":"scalar","membership":"open","cardinality":{"minimum":1,"maximum":1},"ordering":"not_applicable","duplicates":"not_applicable","key_contract":null,"value_contract":null}}],"outputs":[{"name":"preservation_descriptor","semantic_role":"Time-decay preservation descriptor","shared_contract_ref":"TLC-HC-DESCRIPTOR-ENVELOPE@1.0.0","collection":{"kind":"scalar","membership":"open","cardinality":{"minimum":1,"maximum":1},"ordering":"not_applicable","duplicates":"not_applicable","key_contract":null,"value_contract":null}}],"preconditions":[],"postconditions":[{"id":"GP012-O1","statement":"exp(-lambda t) is retained exactly."}],"invariants":[{"id":"GP012-I1","statement":"Unexplained decay is preserved rather than corrected."}],"strategy_contract":{"mode":"open","steps":["preserve the source time-decay factor exactly"],"partial_order":[],"prescription_basis":[]},"runtime_contract":{"mutability":"immutable","result_ownership":"implementation_defined","input_retention":"not_required","input_change_visibility":"not_visible","lifetime":"implementation_defined","aliasing":"not_constrained","layout":"not_constrained","contiguity":"not_required","alignment":"not_required","address_stability":"not_required","copy_semantics":"not_constrained","move_semantics":"not_constrained","allocation":"implementation_defined","zero_copy":"not_required","thread_safety":"implementation_defined","reentrancy":"implementation_defined","failure_atomicity":"no_observable_partial_result"},"determinism":{"semantic_output":"required","field_presence":"required","collection_order":"not_applicable","canonical_serialization":"not_required","binary_layout":"not_constrained","memory_address":"not_constrained","allocation_pattern":"not_constrained","concurrent_scheduling":"implementation_defined","floating_point":"not_specified","randomness":"forbidden"},"error_contract":[],"resource_contract":{"time_complexity":{"status":"not_constrained","value":null},"auxiliary_memory":{"status":"not_constrained","value":null},"allocations":{"status":"implementation_defined","value":null},"maximum_input_size":{"status":"not_constrained","value":null}}}],"implementation_modes":[{"mode_id":"preservation-guard","status":"required","statement":"Preserve the source time-decay factor without repair."}],"global_invariants":[{"id":"GP012-G1","statement":"Feature scientific dependency is domain 04; runtime dependencies are empty; no dependency on domains 28, 30, or 31 is introduced."}],"dependencies":[{"shared_contract_id":"TLC-HC-FEATURE-ID","version":"1.0.0","purpose":"Feature identity."},{"shared_contract_id":"TLC-HC-SCIENTIFIC-REFERENCE","version":"1.0.0","purpose":"Scientific provenance."},{"shared_contract_id":"TLC-HC-REFERENCE-COLLECTION","version":"1.0.0","purpose":"Reference sets."},{"shared_contract_id":"TLC-HC-UNRESOLVED-ITEM","version":"1.0.0","purpose":"Unresolved science."},{"shared_contract_id":"TLC-HC-OPAQUE-VALUE","version":"1.0.0","purpose":"Provider values."},{"shared_contract_id":"TLC-HC-STRUCTURED-ERROR","version":"1.0.0","purpose":"Structured failures."},{"shared_contract_id":"TLC-HC-TRACEABILITY","version":"1.0.0","purpose":"Traceability."},{"shared_contract_id":"TLC-HC-DESCRIPTOR-ENVELOPE","version":"1.0.0","purpose":"Descriptor results."}],"conformance":{"acceptance_required":true,"all_required_tests_must_pass":true,"forbidden_behavior_is_nonconforming":true,"notes":["The source time-decay factor is normative."]}}