{"schema_version":"1.0","package_version":"1.0.0","feature":{"feature_id":"TLC-FC-33-LOW-DATA-ARCHITECTURE-001","title":"Low-data scientific source and architecture ownership descriptor","domain":"low-data-architecture"},"purpose":"Expose Domain 33 as a source-bounded low-data architectural specification and preserve its explicit unresolved limits.","scope":{"required":[{"id":"LDA001-R","statement":"Expose Domain 33 as a source-bounded low-data architectural specification and preserve its explicit unresolved limits.","basis":["maths/33-low-data-architecture/architectural-principles-for-low-data-environments.md"]}],"forbidden":[{"id":"LDA001-F","statement":"Do not import definitions, algorithms, dependencies, or runtime behavior from thematically adjacent domains.","basis":["maths/33-low-data-architecture/architectural-principles-for-low-data-environments.md"]}],"deferred":[]},"operations":[{"operation_id":"HANDLE-LDA-001","purpose":"Expose Domain 33 as a source-bounded low-data architectural specification and preserve its explicit unresolved limits.","inputs":[],"outputs":[{"name":"result_descriptor","semantic_role":"Source-bounded Domain 33 result or preservation descriptor","shared_contract_ref":"TLC-HC-DESCRIPTOR-ENVELOPE@1.0.0","collection":{"kind":"scalar","membership":"open","cardinality":{"minimum":1,"maximum":1},"ordering":"not_applicable","duplicates":"not_applicable","key_contract":null,"value_contract":null},"constraints":[{"id":"LDA-OUT","statement":"Output preserves scientific status, approximation/claim status, symbol disambiguation and unresolved/provider boundaries."}]}],"preconditions":[],"postconditions":[{"id":"LDA001-O","statement":"Expose Domain 33 as a source-bounded low-data architectural specification and preserve its explicit unresolved limits."}],"invariants":[{"id":"LDA001-I","statement":"Do not import definitions, algorithms, dependencies, or runtime behavior from thematically adjacent domains."}],"strategy_contract":{"mode":"open","steps":["Expose Domain 33 as a source-bounded low-data architectural specification and preserve its explicit unresolved limits."],"partial_order":[],"prescription_basis":[]},"runtime_contract":{"mutability":"immutable","result_ownership":"implementation_defined","input_retention":"not_required","input_change_visibility":"not_visible","lifetime":"implementation_defined","aliasing":"not_constrained","layout":"not_constrained","contiguity":"not_required","alignment":"not_required","address_stability":"not_required","copy_semantics":"not_constrained","move_semantics":"not_constrained","allocation":"implementation_defined","zero_copy":"not_required","thread_safety":"implementation_defined","reentrancy":"implementation_defined","failure_atomicity":"no_observable_partial_result"},"determinism":{"semantic_output":"required","field_presence":"required","collection_order":"not_applicable","canonical_serialization":"not_required","binary_layout":"not_constrained","memory_address":"not_constrained","allocation_pattern":"not_constrained","concurrent_scheduling":"implementation_defined","floating_point":"not_specified","randomness":"forbidden"},"error_contract":[{"code":"SourceBoundaryExceeded","category":"source_bounded_science","condition":"The request exceeds supplied providers or source-defined relations, typing, convergence, inverse, normalization, reconstruction, dependency or degenerate-case semantics.","recoverability":"recoverable","public_result":"no_partial_result","failure_atomicity":"no_observable_partial_result","transport":"implementation_defined"}],"resource_contract":{"time_complexity":{"status":"not_constrained","value":null},"auxiliary_memory":{"status":"not_constrained","value":null},"allocations":{"status":"implementation_defined","value":null},"maximum_input_size":{"status":"not_constrained","value":null}}}],"implementation_modes":[{"mode_id":"source-bounded","status":"required","statement":"Implement only source-defined observables and explicit provider/unresolved boundaries."}],"global_invariants":[{"id":"LDA-DEPENDENCY-GUARD","statement":"Domain 33 confirms no scientific dependencies; keeps 33 -> 04 unresolved; does not promote 0, 1, 2, 13, 17, 23, 29, 34 or 35; runtime dependencies are empty; exactly eight shared contracts remain."}],"dependencies":[{"shared_contract_id":"TLC-HC-FEATURE-ID","version":"1.0.0","purpose":"Shared Feature Handoff Package v1.0 contract."},{"shared_contract_id":"TLC-HC-SCIENTIFIC-REFERENCE","version":"1.0.0","purpose":"Shared Feature Handoff Package v1.0 contract."},{"shared_contract_id":"TLC-HC-REFERENCE-COLLECTION","version":"1.0.0","purpose":"Shared Feature Handoff Package v1.0 contract."},{"shared_contract_id":"TLC-HC-UNRESOLVED-ITEM","version":"1.0.0","purpose":"Shared Feature Handoff Package v1.0 contract."},{"shared_contract_id":"TLC-HC-OPAQUE-VALUE","version":"1.0.0","purpose":"Shared Feature Handoff Package v1.0 contract."},{"shared_contract_id":"TLC-HC-STRUCTURED-ERROR","version":"1.0.0","purpose":"Shared Feature Handoff Package v1.0 contract."},{"shared_contract_id":"TLC-HC-TRACEABILITY","version":"1.0.0","purpose":"Shared Feature Handoff Package v1.0 contract."},{"shared_contract_id":"TLC-HC-DESCRIPTOR-ENVELOPE","version":"1.0.0","purpose":"Shared Feature Handoff Package v1.0 contract."}],"conformance":{"acceptance_required":true,"all_required_tests_must_pass":true,"forbidden_behavior_is_nonconforming":true,"notes":["Ambiguity, approximation, theorem/claim status, symbol collisions and provider boundaries are normative."]}}
