{"schema_version":"1.0","package_version":"1.0.0","feature":{"feature_id":"TLC-FC-20-ROBUSTNESS-034","title":"Robustness health threshold predicate","domain":"robustness"},"purpose":"Evaluate the exact strict source predicate Q_rob^T > 0.75.","scope":{"required":[{"id":"ROB034-R","statement":"Use exactly the strict comparator > and threshold 0.75."}],"forbidden":[{"id":"ROB034-F","statement":"Do not use >=, calibrate, generalize, tune, randomize, or replace the threshold."}],"deferred":[{"id":"ROB034-D","statement":"Scientific derivation/calibration of 0.75 is absent from the source."}]},"operations":[{"operation_id":"EVALUATE-ROBUSTNESS-034","purpose":"Return whether supplied Q_rob^T is strictly greater than 0.75.","inputs":[{"name":"Q_rob_T","semantic_role":"Supplied raw robustness health index","shared_contract_ref":"TLC-HC-OPAQUE-VALUE@1.0.0","collection":{"kind":"scalar","membership":"exact","cardinality":{"minimum":1,"maximum":1},"ordering":"not_applicable","duplicates":"not_applicable","key_contract":null,"value_contract":null}}],"outputs":[{"name":"result","semantic_role":"Strict source predicate result","shared_contract_ref":"TLC-HC-DESCRIPTOR-ENVELOPE@1.0.0","collection":{"kind":"scalar","membership":"exact","cardinality":{"minimum":1,"maximum":1},"ordering":"not_applicable","duplicates":"not_applicable","key_contract":null,"value_contract":null}}],"preconditions":[{"id":"ROB034-P","statement":"A comparable Q_rob^T value is supplied."}],"postconditions":[{"id":"ROB034-O","statement":"Return true iff Q_rob^T > 0.75."}],"invariants":[{"id":"ROB034-I","statement":"Q_rob^T=0.75 returns false."}],"strategy_contract":{"mode":"prescribed","steps":["compare Q_rob^T strictly to 0.75","return boolean predicate result"],"partial_order":[],"prescription_basis":["registry/algorithms/robustness/TLC-FC-20-ROBUSTNESS-034/algorithm.yaml"]},"runtime_contract":{"mutability":"immutable","result_ownership":"implementation_defined","input_retention":"not_required","input_change_visibility":"not_visible","lifetime":"implementation_defined","aliasing":"not_constrained","layout":"not_constrained","contiguity":"not_required","alignment":"not_required","address_stability":"not_required","copy_semantics":"not_constrained","move_semantics":"not_constrained","allocation":"implementation_defined","zero_copy":"not_required","thread_safety":"implementation_defined","reentrancy":"implementation_defined","failure_atomicity":"no_observable_partial_result"},"determinism":{"semantic_output":"required","field_presence":"required","collection_order":"not_applicable","canonical_serialization":"not_required","binary_layout":"not_constrained","memory_address":"not_constrained","allocation_pattern":"not_constrained","concurrent_scheduling":"implementation_defined","floating_point":"not_specified","randomness":"not_applicable"},"error_contract":[],"resource_contract":{"time_complexity":{"status":"not_constrained","value":null},"auxiliary_memory":{"status":"not_constrained","value":null},"allocations":{"status":"implementation_defined","value":null},"maximum_input_size":{"status":"not_constrained","value":null}}}],"implementation_modes":[{"mode_id":"exact-source-predicate","status":"required","statement":"Use strict > 0.75 only."}],"global_invariants":[{"id":"ROB034-G","statement":"0.75 is source-declared operational, not derived/calibrated/universal."}],"dependencies":[{"shared_contract_id":"TLC-HC-FEATURE-ID","version":"1.0.0","purpose":"Identity."},{"shared_contract_id":"TLC-HC-SCIENTIFIC-REFERENCE","version":"1.0.0","purpose":"Provenance."},{"shared_contract_id":"TLC-HC-REFERENCE-COLLECTION","version":"1.0.0","purpose":"References."},{"shared_contract_id":"TLC-HC-UNRESOLVED-ITEM","version":"1.0.0","purpose":"Unresolved calibration status."},{"shared_contract_id":"TLC-HC-OPAQUE-VALUE","version":"1.0.0","purpose":"Input value."},{"shared_contract_id":"TLC-HC-STRUCTURED-ERROR","version":"1.0.0","purpose":"Errors."},{"shared_contract_id":"TLC-HC-TRACEABILITY","version":"1.0.0","purpose":"Traceability."},{"shared_contract_id":"TLC-HC-DESCRIPTOR-ENVELOPE","version":"1.0.0","purpose":"Predicate result."}],"conformance":{"acceptance_required":true,"all_required_tests_must_pass":true,"forbidden_behavior_is_nonconforming":true,"notes":["Threshold is exact and scope-limited."]}}
