{"schema_version":"1.0","package_version":"1.0.0","feature":{"feature_id":"TLC-FC-17-CASCADE-TRANSMISSION-017","title":"Doctrinal-graph structural descriptor","domain":"cascade-transmission"},"purpose":"Preserve G_D=(V_D,E_D,w_D,phi_D) as the source doctrinal graph.","scope":{"required":[{"id":"CAS017-R","statement":"Preserve G_D=(V_D,E_D,w_D,phi_D) as the source doctrinal graph.","basis":["maths/17-cascade-transmission/cascade-transmission-system.md"]}],"forbidden":[{"id":"CAS017-F","statement":"Do not infer an algebraic representation from the graph tuple.","basis":["maths/17-cascade-transmission/cascade-transmission-system.md"]}],"deferred":[{"id":"CAS017-D","statement":"Preserve unresolved/provider items: TLC-UR-CAS-006, TLC-UR-CAS-009, TLC-UR-CAS-018, TLC-UR-CAS-019, TLC-UR-CAS-026, TLC-UR-CAS-033, TLC-UR-CAS-035, TLC-UR-CAS-051, TLC-UR-CAS-072, TLC-UR-CAS-073, TLC-UR-CAS-084, TLC-UR-CAS-095."}]},"operations":[{"operation_id":"HANDLE-CAS-017","purpose":"Preserve G_D=(V_D,E_D,w_D,phi_D) as the source doctrinal graph.","inputs":[],"outputs":[{"name":"result_descriptor","semantic_role":"Source-bounded Cascade Transmission preservation descriptor","shared_contract_ref":"TLC-HC-DESCRIPTOR-ENVELOPE@1.0.0","collection":{"kind":"scalar","membership":"open","cardinality":{"minimum":1,"maximum":1},"ordering":"not_applicable","duplicates":"not_applicable","key_contract":null,"value_contract":null},"constraints":[{"id":"CAS017-OUT","statement":"Output must preserve the declared scientific status, exact source relation, and provider/unresolved boundary."}]}],"preconditions":[],"postconditions":[{"id":"CAS017-O","statement":"Preserve G_D=(V_D,E_D,w_D,phi_D) as the source doctrinal graph."}],"invariants":[{"id":"CAS017-I","statement":"Do not infer an algebraic representation from the graph tuple."}],"strategy_contract":{"mode":"open","steps":["Preserve G_D=(V_D,E_D,w_D,phi_D) as the source doctrinal graph."],"partial_order":[],"prescription_basis":[]},"runtime_contract":{"mutability":"immutable","result_ownership":"implementation_defined","input_retention":"not_required","input_change_visibility":"not_visible","lifetime":"implementation_defined","aliasing":"not_constrained","layout":"not_constrained","contiguity":"not_required","alignment":"not_required","address_stability":"not_required","copy_semantics":"not_constrained","move_semantics":"not_constrained","allocation":"implementation_defined","zero_copy":"not_required","thread_safety":"implementation_defined","reentrancy":"implementation_defined","failure_atomicity":"no_observable_partial_result"},"determinism":{"semantic_output":"required","field_presence":"required","collection_order":"not_applicable","canonical_serialization":"not_required","binary_layout":"not_constrained","memory_address":"not_constrained","allocation_pattern":"not_constrained","concurrent_scheduling":"implementation_defined","floating_point":"not_specified","randomness":"forbidden"},"error_contract":[{"code":"SourceBoundaryExceeded","category":"source_bounded_science","condition":"The request exceeds supplied providers or the relation/structure actually defined by the source.","recoverability":"recoverable","public_result":"no_partial_result","failure_atomicity":"no_observable_partial_result","transport":"implementation_defined"}],"resource_contract":{"time_complexity":{"status":"not_constrained","value":null},"auxiliary_memory":{"status":"not_constrained","value":null},"allocations":{"status":"implementation_defined","value":null},"maximum_input_size":{"status":"not_constrained","value":null}}}],"implementation_modes":[{"mode_id":"source-bounded","status":"required","statement":"Implement only source-defined observables and explicit provider/unresolved boundaries."}],"global_invariants":[{"id":"CAS017-G","statement":"Domain 17 has no confirmed scientific domain dependency; 17 -> 04 remains unresolved; domains 09, 19, 22, 24, 29 and 34 are non-proven; runtime dependencies are empty."}],"dependencies":[{"shared_contract_id":"TLC-HC-FEATURE-ID","version":"1.0.0","purpose":"Shared Feature Handoff Package v1.0 contract."},{"shared_contract_id":"TLC-HC-SCIENTIFIC-REFERENCE","version":"1.0.0","purpose":"Shared Feature Handoff Package v1.0 contract."},{"shared_contract_id":"TLC-HC-REFERENCE-COLLECTION","version":"1.0.0","purpose":"Shared Feature Handoff Package v1.0 contract."},{"shared_contract_id":"TLC-HC-UNRESOLVED-ITEM","version":"1.0.0","purpose":"Shared Feature Handoff Package v1.0 contract."},{"shared_contract_id":"TLC-HC-OPAQUE-VALUE","version":"1.0.0","purpose":"Shared Feature Handoff Package v1.0 contract."},{"shared_contract_id":"TLC-HC-STRUCTURED-ERROR","version":"1.0.0","purpose":"Shared Feature Handoff Package v1.0 contract."},{"shared_contract_id":"TLC-HC-TRACEABILITY","version":"1.0.0","purpose":"Shared Feature Handoff Package v1.0 contract."},{"shared_contract_id":"TLC-HC-DESCRIPTOR-ENVELOPE","version":"1.0.0","purpose":"Shared Feature Handoff Package v1.0 contract."}],"conformance":{"acceptance_required":true,"all_required_tests_must_pass":true,"forbidden_behavior_is_nonconforming":true,"notes":["Scientific ambiguity preservation is normative."]}}
