{"schema_version":"1.0","package_version":"1.0.0","feature":{"feature_id":"TLC-FC-20-ROBUSTNESS-009","title":"Transferable principles descriptor","domain":"robustness"},"purpose":"Expose the source quantified transferable-principles condition without implementing search or proof.","scope":{"required":[{"id":"ROB009-R","statement":"Preserve the forall/exists source condition and fidelity bound."}],"forbidden":[{"id":"ROB009-F","statement":"Do not enumerate universal contexts, search alpha witnesses, build a proof engine, or invent spaces."}],"deferred":[{"id":"ROB009-D","statement":"Principle/context spaces, transfer operator, norm, fidelity and witnesses remain provider-owned."}]},"operations":[{"operation_id":"DESCRIBE-ROBUSTNESS-009","purpose":"Return the quantified source descriptor.","inputs":[{"name":"references","semantic_role":"Source/provider references","shared_contract_ref":"TLC-HC-REFERENCE-COLLECTION@1.0.0","collection":{"kind":"sequence","membership":"constrained","cardinality":{"minimum":1,"maximum":null},"ordering":"preserved","duplicates":"forbidden","key_contract":null,"value_contract":null}}],"outputs":[{"name":"descriptor","semantic_role":"Quantified transferable-principles descriptor","shared_contract_ref":"TLC-HC-DESCRIPTOR-ENVELOPE@1.0.0","collection":{"kind":"scalar","membership":"exact","cardinality":{"minimum":1,"maximum":1},"ordering":"not_applicable","duplicates":"not_applicable","key_contract":null,"value_contract":null}}],"preconditions":[{"id":"ROB009-P","statement":"Source condition is available."}],"postconditions":[{"id":"ROB009-O","statement":"Quantifiers remain declarative."}],"invariants":[{"id":"ROB009-I","statement":"No search or proof is executed."}],"strategy_contract":{"mode":"prescribed","steps":["preserve quantified condition","emit descriptor"],"partial_order":[],"prescription_basis":["registry/algorithms/robustness/TLC-FC-20-ROBUSTNESS-009/algorithm.yaml"]},"runtime_contract":{"mutability":"immutable","result_ownership":"implementation_defined","input_retention":"not_required","input_change_visibility":"not_visible","lifetime":"implementation_defined","aliasing":"not_constrained","layout":"not_constrained","contiguity":"not_required","alignment":"not_required","address_stability":"not_required","copy_semantics":"not_constrained","move_semantics":"not_constrained","allocation":"implementation_defined","zero_copy":"not_required","thread_safety":"implementation_defined","reentrancy":"implementation_defined","failure_atomicity":"no_observable_partial_result"},"determinism":{"semantic_output":"required","field_presence":"required","collection_order":"required","canonical_serialization":"not_required","binary_layout":"not_constrained","memory_address":"not_constrained","allocation_pattern":"not_constrained","concurrent_scheduling":"implementation_defined","floating_point":"not_applicable","randomness":"not_applicable"},"error_contract":[],"resource_contract":{"time_complexity":{"status":"not_constrained","value":null},"auxiliary_memory":{"status":"not_constrained","value":null},"allocations":{"status":"implementation_defined","value":null},"maximum_input_size":{"status":"not_constrained","value":null}}}],"implementation_modes":[{"mode_id":"structural-descriptor","status":"required","statement":"Descriptor only; no solver."}],"global_invariants":[{"id":"ROB009-G","statement":"Quantifiers are not operationalized by hidden enumeration/search."}],"dependencies":[{"shared_contract_id":"TLC-HC-FEATURE-ID","version":"1.0.0","purpose":"Identity."},{"shared_contract_id":"TLC-HC-SCIENTIFIC-REFERENCE","version":"1.0.0","purpose":"Provenance."},{"shared_contract_id":"TLC-HC-REFERENCE-COLLECTION","version":"1.0.0","purpose":"References."},{"shared_contract_id":"TLC-HC-UNRESOLVED-ITEM","version":"1.0.0","purpose":"Unresolved science."},{"shared_contract_id":"TLC-HC-OPAQUE-VALUE","version":"1.0.0","purpose":"Opaque values."},{"shared_contract_id":"TLC-HC-STRUCTURED-ERROR","version":"1.0.0","purpose":"Errors."},{"shared_contract_id":"TLC-HC-TRACEABILITY","version":"1.0.0","purpose":"Traceability."},{"shared_contract_id":"TLC-HC-DESCRIPTOR-ENVELOPE","version":"1.0.0","purpose":"Descriptor."}],"conformance":{"acceptance_required":true,"all_required_tests_must_pass":true,"forbidden_behavior_is_nonconforming":true,"notes":["The quantified definition remains scientific structure."]}}
