{"schema_version":"1.0","package_version":"1.0.0","feature":{"feature_id":"TLC-FC-20-ROBUSTNESS-031","title":"Integrated dynamics right-hand side","domain":"robustness"},"purpose":"Evaluate the four exact source RHS expressions without integrating the coupled system.","scope":{"required":[{"id":"ROB031-R","statement":"Preserve all four RHS expressions and their local overloaded R/E/A/F meanings."}],"forbidden":[{"id":"ROB031-F","statement":"Do not integrate ODEs, choose time steps, construct gradients, estimate coefficients, find fixed points, or discretize."}],"deferred":[{"id":"ROB031-D","statement":"All gradients, coefficients, state products and tradition derivative remain provider-owned."}]},"operations":[{"operation_id":"EVALUATE-ROBUSTNESS-031-RHS","purpose":"Evaluate supplied RHS operands for all four coupled components.","inputs":[{"name":"scientific_inputs","semantic_role":"Provider states, coefficients, gradients and dot T","shared_contract_ref":"TLC-HC-OPAQUE-VALUE@1.0.0","collection":{"kind":"map","membership":"constrained","cardinality":{"minimum":1,"maximum":null},"ordering":"implementation_defined","duplicates":"not_applicable","key_contract":null,"value_contract":null}}],"outputs":[{"name":"rhs_vector","semantic_role":"Four source RHS values","shared_contract_ref":"TLC-HC-DESCRIPTOR-ENVELOPE@1.0.0","collection":{"kind":"sequence","membership":"exact","cardinality":{"minimum":4,"maximum":4},"ordering":"required","duplicates":"allowed","key_contract":null,"value_contract":null}}],"preconditions":[{"id":"ROB031-P","statement":"All operands needed by the four RHS expressions are supplied."}],"postconditions":[{"id":"ROB031-O","statement":"Return RHS values only, in R/E/A/F source order."}],"invariants":[{"id":"ROB031-I","statement":"No temporal integration or overloaded-symbol unification occurs."}],"strategy_contract":{"mode":"prescribed","steps":["evaluate dot R RHS","evaluate dot E RHS","evaluate dot A RHS","evaluate dot F RHS","return four RHS values"],"partial_order":[],"prescription_basis":["registry/algorithms/robustness/TLC-FC-20-ROBUSTNESS-031/algorithm.yaml"]},"runtime_contract":{"mutability":"immutable","result_ownership":"implementation_defined","input_retention":"not_required","input_change_visibility":"not_visible","lifetime":"implementation_defined","aliasing":"not_constrained","layout":"not_constrained","contiguity":"not_required","alignment":"not_required","address_stability":"not_required","copy_semantics":"not_constrained","move_semantics":"not_constrained","allocation":"implementation_defined","zero_copy":"not_required","thread_safety":"implementation_defined","reentrancy":"implementation_defined","failure_atomicity":"no_observable_partial_result"},"determinism":{"semantic_output":"required","field_presence":"required","collection_order":"required","canonical_serialization":"not_required","binary_layout":"not_constrained","memory_address":"not_constrained","allocation_pattern":"not_constrained","concurrent_scheduling":"implementation_defined","floating_point":"not_specified","randomness":"not_applicable"},"error_contract":[{"code":"IntegratedDynamicsProviderRequired","category":"scientific_provider","condition":"A required state/coefficient/gradient operand is absent.","recoverability":"recoverable","public_result":"no_partial_result","failure_atomicity":"no_observable_partial_result","transport":"implementation_defined"}],"resource_contract":{"time_complexity":{"status":"not_constrained","value":null},"auxiliary_memory":{"status":"not_constrained","value":null},"allocations":{"status":"implementation_defined","value":null},"maximum_input_size":{"status":"not_constrained","value":null}}}],"implementation_modes":[{"mode_id":"rhs-evaluator","status":"required","statement":"Evaluate RHS values only; no ODE solver."}],"global_invariants":[{"id":"ROB031-G","statement":"No solver, time-step or numerical gradient is introduced."}],"dependencies":[{"shared_contract_id":"TLC-HC-FEATURE-ID","version":"1.0.0","purpose":"Identity."},{"shared_contract_id":"TLC-HC-SCIENTIFIC-REFERENCE","version":"1.0.0","purpose":"Provenance."},{"shared_contract_id":"TLC-HC-REFERENCE-COLLECTION","version":"1.0.0","purpose":"References."},{"shared_contract_id":"TLC-HC-UNRESOLVED-ITEM","version":"1.0.0","purpose":"Unresolved science."},{"shared_contract_id":"TLC-HC-OPAQUE-VALUE","version":"1.0.0","purpose":"Provider values."},{"shared_contract_id":"TLC-HC-STRUCTURED-ERROR","version":"1.0.0","purpose":"Errors."},{"shared_contract_id":"TLC-HC-TRACEABILITY","version":"1.0.0","purpose":"Traceability."},{"shared_contract_id":"TLC-HC-DESCRIPTOR-ENVELOPE","version":"1.0.0","purpose":"RHS result."}],"conformance":{"acceptance_required":true,"all_required_tests_must_pass":true,"forbidden_behavior_is_nonconforming":true,"notes":["RHS evaluation is intentionally solver-free."]}}
