{"schema_version":"1.0","package_version":"1.0.0","feature":{"feature_id":"TLC-FC-32-DRIFT-AND-CORRECTION-012","title":"Schism-path ambiguity descriptor","domain":"drift-and-correction"},"purpose":"Preserve the four conceptual schism labels and their unresolved articulation with the mathematical rupture conjunction without inventing executable path models.","scope":{"required":[{"id":"DRI012-R","statement":"Retain doctrinal, institutional, cultural, and personal as conceptual labels only."}],"forbidden":[{"id":"DRI012-F","statement":"Do not invent separate equations/classifiers, a taxonomy algorithm, or replace the rupture AND with OR."}],"deferred":[{"id":"DRI012-D","statement":"The mathematical articulation of conceptual paths with the rupture predicate remains unresolved."}]},"operations":[{"operation_id":"DESCRIBE-DRIFT-012","purpose":"Return the conceptual schism-path descriptor and unresolved reservation.","inputs":[],"outputs":[{"name":"schism_path_descriptor","semantic_role":"Four labels plus unresolved-articulation status","shared_contract_ref":"TLC-HC-DESCRIPTOR-ENVELOPE@1.0.0","collection":{"kind":"scalar","membership":"exact","cardinality":{"minimum":1,"maximum":1},"ordering":"not_applicable","duplicates":"not_applicable","key_contract":null,"value_contract":null}}],"preconditions":[],"postconditions":[{"id":"DRI012-O","statement":"Four labels are preserved without equations."}],"invariants":[{"id":"DRI012-I","statement":"The separate rupture predicate remains four-way AND."}],"strategy_contract":{"mode":"prescribed","steps":["emit four conceptual labels","attach unresolved articulation reservation","reject executable path model"],"partial_order":[],"prescription_basis":["registry/algorithms/drift-and-correction/TLC-FC-32-DRIFT-AND-CORRECTION-012/algorithm.yaml"]},"runtime_contract":{"mutability":"immutable","result_ownership":"implementation_defined","input_retention":"not_applicable","input_change_visibility":"not_applicable","lifetime":"implementation_defined","aliasing":"not_applicable","layout":"not_constrained","contiguity":"not_applicable","alignment":"not_applicable","address_stability":"not_applicable","copy_semantics":"not_constrained","move_semantics":"not_constrained","allocation":"implementation_defined","zero_copy":"not_applicable","thread_safety":"implementation_defined","reentrancy":"implementation_defined","failure_atomicity":"no_observable_partial_result"},"determinism":{"semantic_output":"required","field_presence":"required","collection_order":"not_applicable","canonical_serialization":"not_required","binary_layout":"not_constrained","memory_address":"not_constrained","allocation_pattern":"not_constrained","concurrent_scheduling":"implementation_defined","floating_point":"not_applicable","randomness":"not_applicable"},"error_contract":[{"code":"SchismPathModelUnavailable","category":"unsupported_operation","condition":"Executable schism-path classification or separate equations are requested.","recoverability":"non_retryable","public_result":"error_only","failure_atomicity":"no_observable_partial_result","transport":"implementation_defined"}],"resource_contract":{"time_complexity":{"status":"not_constrained","value":null},"auxiliary_memory":{"status":"not_constrained","value":null},"allocations":{"status":"implementation_defined","value":null},"maximum_input_size":{"status":"not_constrained","value":null}}}],"implementation_modes":[{"mode_id":"conceptual-descriptor-only","status":"required","statement":"Expose labels and ambiguity only."}],"global_invariants":[{"id":"DRI012-G","statement":"Conceptual plurality does not imply OR semantics."}],"dependencies":[{"shared_contract_id":"TLC-HC-FEATURE-ID","version":"1.0.0","purpose":"Identity."},{"shared_contract_id":"TLC-HC-SCIENTIFIC-REFERENCE","version":"1.0.0","purpose":"Provenance."},{"shared_contract_id":"TLC-HC-REFERENCE-COLLECTION","version":"1.0.0","purpose":"Label references."},{"shared_contract_id":"TLC-HC-UNRESOLVED-ITEM","version":"1.0.0","purpose":"Articulation ambiguity."},{"shared_contract_id":"TLC-HC-OPAQUE-VALUE","version":"1.0.0","purpose":"Opaque conceptual values if extended."},{"shared_contract_id":"TLC-HC-STRUCTURED-ERROR","version":"1.0.0","purpose":"Unavailable-model error."},{"shared_contract_id":"TLC-HC-TRACEABILITY","version":"1.0.0","purpose":"Traceability."},{"shared_contract_id":"TLC-HC-DESCRIPTOR-ENVELOPE","version":"1.0.0","purpose":"Descriptor output."}],"conformance":{"acceptance_required":true,"all_required_tests_must_pass":true,"forbidden_behavior_is_nonconforming":true,"notes":["No equations are supplied for the four conceptual schism paths."]}}
