{"schema_version":"1.0","package_version":"1.0.0","feature":{"feature_id":"TLC-FC-25-CULTURE-006","title":"Cultural adaptation delegation to Context","domain":"culture"},"purpose":"Delegate legitimate cultural adaptation to a caller-supplied Context adaptation provider while preserving externally identified robust elements.","scope":{"required":[{"id":"CU006-REQ-001","statement":"Require a TLC-FC-24-CONTEXT-007 conformant provider plus external sensitive-form and robust-preservation evidence.","basis":["registry/math-contracts/TLC-FC-25-CULTURE-006/contract.yaml"]}],"forbidden":[{"id":"CU006-FOR-001","statement":"Do not construct A_culture, optimize locally, differentiate locally, or infer eligible forms without evidence."}],"deferred":[{"id":"CU006-DEF-001","statement":"Eligibility and robust-element identification remain external scientific evidence."}]},"operations":[{"operation_id":"DELEGATE-CULTURE-006","purpose":"Delegate cultural adaptation to Context A_contexte authority.","inputs":[{"name":"scientific_inputs","semantic_role":"Context adaptation inputs provider and external eligibility/preservation evidence","shared_contract_ref":"TLC-HC-OPAQUE-VALUE@1.0.0","collection":{"kind":"map","membership":"constrained","cardinality":{"minimum":1,"maximum":null},"ordering":"implementation_defined","duplicates":"not_applicable","key_contract":null,"value_contract":null}}],"outputs":[{"name":"result","semantic_role":"delegated cultural adaptation result envelope","shared_contract_ref":"TLC-HC-DESCRIPTOR-ENVELOPE@1.0.0","collection":{"kind":"scalar","membership":"exact","cardinality":{"minimum":1,"maximum":1},"ordering":"not_applicable","duplicates":"not_applicable","key_contract":null,"value_contract":null}}],"preconditions":[{"id":"CU006-PRE-001","statement":"Context provider conformance, sensitive-form evidence, and robust-preservation evidence are all present."}],"postconditions":[{"id":"CU006-POST-001","statement":"The result is delegated through A_contexte and carries preservation obligations for robust elements."}],"invariants":[{"id":"CU006-INV-001","statement":"A_contexte remains the only adaptation operator and no robust element is locally changed by the Culture specification."}],"strategy_contract":{"mode":"prescribed","steps":["verify Context adaptation provider","require sensitive-form evidence","require robust-preservation evidence","delegate to Context provider","return result with obligations"],"partial_order":[{"before":"verify Context adaptation provider","after":"delegate to Context provider"},{"before":"require sensitive-form evidence","after":"delegate to Context provider"},{"before":"delegate to Context provider","after":"return result with obligations"}],"prescription_basis":["registry/algorithms/culture/TLC-FC-25-CULTURE-006/algorithm.yaml"]},"runtime_contract":{"mutability":"immutable","result_ownership":"implementation_defined","input_retention":"not_required","input_change_visibility":"not_visible","lifetime":"implementation_defined","aliasing":"not_constrained","layout":"not_constrained","contiguity":"not_required","alignment":"not_required","address_stability":"not_required","copy_semantics":"not_constrained","move_semantics":"not_constrained","allocation":"implementation_defined","zero_copy":"not_required","thread_safety":"implementation_defined","reentrancy":"implementation_defined","failure_atomicity":"no_observable_partial_result"},"determinism":{"semantic_output":"required","field_presence":"required","collection_order":"not_required","canonical_serialization":"not_required","binary_layout":"not_constrained","memory_address":"not_constrained","allocation_pattern":"not_constrained","concurrent_scheduling":"implementation_defined","floating_point":"implementation_defined","randomness":"not_applicable"},"error_contract":[{"code":"CultureContextAdaptationProviderRequired","category":"scientific_provider","condition":"The Context adaptation provider is absent.","recoverability":"recoverable","public_result":"no_partial_result","failure_atomicity":"no_observable_partial_result","transport":"implementation_defined"},{"code":"CulturePlasticityEvidenceRequired","category":"scientific_evidence","condition":"Sensitive-form eligibility evidence is absent.","recoverability":"recoverable","public_result":"no_partial_result","failure_atomicity":"no_observable_partial_result","transport":"implementation_defined"},{"code":"CultureRobustPreservationEvidenceRequired","category":"scientific_evidence","condition":"Robust-element preservation evidence is absent.","recoverability":"recoverable","public_result":"no_partial_result","failure_atomicity":"no_observable_partial_result","transport":"implementation_defined"}],"resource_contract":{"time_complexity":{"status":"not_constrained","value":null},"auxiliary_memory":{"status":"not_constrained","value":null},"allocations":{"status":"implementation_defined","value":null},"maximum_input_size":{"status":"not_constrained","value":null}}}],"implementation_modes":[{"mode_id":"context-provider-cultural-adaptation","status":"required","statement":"Delegate only through Context authority with external eligibility and preservation evidence."}],"global_invariants":[{"id":"CU006-GINV-001","statement":"Scientific dependence on Context remains explicit without an autonomous Culture operator or direct runtime package dependency."}],"dependencies":[{"shared_contract_id":"TLC-HC-FEATURE-ID","version":"1.0.0","purpose":"Exact feature identity."},{"shared_contract_id":"TLC-HC-SCIENTIFIC-REFERENCE","version":"1.0.0","purpose":"Scientific provenance."},{"shared_contract_id":"TLC-HC-REFERENCE-COLLECTION","version":"1.0.0","purpose":"Reference collections."},{"shared_contract_id":"TLC-HC-UNRESOLVED-ITEM","version":"1.0.0","purpose":"Unresolved reservations."},{"shared_contract_id":"TLC-HC-OPAQUE-VALUE","version":"1.0.0","purpose":"Opaque scientific values."},{"shared_contract_id":"TLC-HC-STRUCTURED-ERROR","version":"1.0.0","purpose":"Structured failures."},{"shared_contract_id":"TLC-HC-TRACEABILITY","version":"1.0.0","purpose":"Traceability."},{"shared_contract_id":"TLC-HC-DESCRIPTOR-ENVELOPE","version":"1.0.0","purpose":"Result envelope."}],"conformance":{"acceptance_required":true,"all_required_tests_must_pass":true,"forbidden_behavior_is_nonconforming":true,"notes":["Culture adaptation is explicitly a case of A_contexte."]}}
